{
  "$schema": "https://json-schema.org/draft/2020-12/schema",
  "$id": "https://raw.githubusercontent.com/sankarshanmukhopadhyay/trust-systems-meta-model/v0.21.0/schemas/tsmm-lifecycle.schema.json",
  "title": "TSMM Lifecycle State Model",
  "description": "Machine-readable lifecycle states and transitions for trust-relevant objects in TSMM.",
  "type": "object",
  "required": [
    "modelId",
    "label",
    "states",
    "transitions"
  ],
  "properties": {
    "modelId": {
      "$ref": "#/$defs/idString"
    },
    "label": {
      "type": "string"
    },
    "appliesTo": {
      "type": "array",
      "items": {
        "type": "string"
      }
    },
    "states": {
      "type": "array",
      "minItems": 5,
      "items": {
        "$ref": "#/$defs/state"
      }
    },
    "transitions": {
      "type": "array",
      "minItems": 4,
      "items": {
        "$ref": "#/$defs/transition"
      }
    }
  },
  "$defs": {
    "idString": {
      "type": "string",
      "pattern": "^[A-Za-z0-9._:-]+$"
    },
    "state": {
      "type": "object",
      "required": [
        "id",
        "name",
        "description"
      ],
      "properties": {
        "id": {
          "$ref": "#/$defs/idString"
        },
        "name": {
          "type": "string",
          "enum": [
            "issued",
            "active",
            "suspended",
            "revoked",
            "expired"
          ]
        },
        "description": {
          "type": "string"
        },
        "entryEvidence": {
          "type": "string"
        }
      },
      "additionalProperties": false
    },
    "transition": {
      "type": "object",
      "required": [
        "id",
        "from",
        "to",
        "trigger",
        "actor",
        "evidenceRequirement"
      ],
      "properties": {
        "id": {
          "$ref": "#/$defs/idString"
        },
        "from": {
          "type": "string"
        },
        "to": {
          "type": "string"
        },
        "trigger": {
          "type": "string"
        },
        "actor": {
          "type": "string"
        },
        "evidenceRequirement": {
          "type": "string"
        },
        "notes": {
          "type": "string"
        }
      },
      "additionalProperties": false
    }
  },
  "additionalProperties": false
}
